{
  "status": "ok",
  "mode": "augment",
  "count": 1,
  "instruments": [
    {
      "Chunk": {
        "finaRefChunkID": 0,
        "priority": "Normal",
        "finaRefEnv": "ABC",
        "finaRefHostname": "FINA1",
        "finaRefNPID": "31104",
        "finaRefUserID": "finaRefBO",
        "libVersion": "AE",
        "modelVersion": 2,
        "Jobs": [
          {
            "finaRefJobID": 0,
            "commonData": {
              "marketData": {
                "fx": [],
                "equity": [
                  {
                    "_id": "ADBE UW",
                    "currency": "USD",
                    "bid": 267.8,
                    "spot": 267.885,
                    "ask": 267.97,
                    "divType": "cash",
                    "dividend": [],
                    "close": null
                  },
                  {
                    "_id": "AMZN UW",
                    "currency": "USD",
                    "bid": 258.32,
                    "spot": 258.355,
                    "ask": 258.39,
                    "divType": "cash",
                    "dividend": [
                      {
                        "exDate": 46332,
                        "div": 0.31
                      },
                      {
                        "exDate": 46430,
                        "div": 0.4
                      },
                      {
                        "exDate": 46512,
                        "div": 0.4
                      },
                      {
                        "exDate": 46610,
                        "div": 0.4
                      },
                      {
                        "exDate": 46696,
                        "div": 0.4
                      },
                      {
                        "exDate": 46793,
                        "div": 0.5
                      },
                      {
                        "exDate": 46875,
                        "div": 0.5
                      },
                      {
                        "exDate": 46974,
                        "div": 0.5
                      },
                      {
                        "exDate": 47060,
                        "div": 0.5
                      },
                      {
                        "exDate": 47157,
                        "div": 0.58
                      },
                      {
                        "exDate": 47246,
                        "div": 0.58
                      },
                      {
                        "exDate": 47345,
                        "div": 0.58
                      },
                      {
                        "exDate": 47431,
                        "div": 0.58
                      }
                    ],
                    "close": null
                  }
                ],
                "corr": [
                  {
                    "_id": [
                      "ADBE UW",
                      "AMZN UW"
                    ],
                    "correlation": [
                      {
                        "_id": "ADBE UW-AMZN UW",
                        "correlation": 0.4593248180905
                      }
                    ]
                  }
                ],
                "eqVol": [
                  {
                    "strike": [
                      133.235,
                      159.882,
                      186.529,
                      213.176,
                      239.823,
                      253.1465,
                      255.8112,
                      258.4759,
                      261.1406,
                      263.8053,
                      266.47,
                      269.1347,
                      271.7994,
                      274.4641,
                      277.1288,
                      279.7935,
                      293.117,
                      319.764,
                      346.411,
                      373.058,
                      399.705
                    ],
                    "vol": [
                      [
                        48.767684,
                        48.950222,
                        49.164479,
                        49.930392,
                        50.390199,
                        50.594673,
                        50.639089,
                        50.685189,
                        50.733193,
                        50.783331,
                        50.835842,
                        50.890981,
                        50.949022,
                        51.010258,
                        51.075007,
                        51.143616,
                        51.55929,
                        53.03513,
                        57.201475,
                        68.258414,
                        81.858739
                      ],
                      [
                        83.709306,
                        67.73362,
                        53.304439,
                        47.004795,
                        45.87482,
                        46.115868,
                        46.190658,
                        46.271644,
                        46.35802,
                        46.449101,
                        46.544302,
                        46.643127,
                        46.745146,
                        46.849991,
                        46.95734,
                        47.066912,
                        47.640285,
                        48.850956,
                        50.047741,
                        51.131787,
                        52.015507
                      ],
                      [
                        51.174885,
                        48.687811,
                        47.157797,
                        47.071996,
                        46.69616,
                        46.647663,
                        46.650091,
                        46.65652,
                        46.666914,
                        46.681228,
                        46.699411,
                        46.721405,
                        46.74715,
                        46.776577,
                        46.809615,
                        46.846191,
                        47.079323,
                        47.762806,
                        48.666378,
                        49.718527,
                        50.865674
                      ],
                      [
                        52.00711,
                        47.890661,
                        45.888863,
                        45.039058,
                        44.823599,
                        44.855704,
                        44.86833,
                        44.882144,
                        44.897091,
                        44.913318,
                        44.931012,
                        44.950299,
                        44.97123,
                        44.993804,
                        45.017985,
                        45.043719,
                        45.193367,
                        45.572136,
                        46.016311,
                        46.49418,
                        46.98662
                      ],
                      [
                        51.418807,
                        49.45068,
                        47.693518,
                        46.226795,
                        45.226846,
                        44.969683,
                        44.938027,
                        44.913038,
                        44.894581,
                        44.882098,
                        44.874702,
                        44.871464,
                        44.871601,
                        44.8745,
                        44.879683,
                        44.886777,
                        44.941915,
                        45.095808,
                        45.260433,
                        45.42035,
                        45.573281
                      ],
                      [
                        49.660894,
                        48.413001,
                        47.372793,
                        46.489572,
                        45.746865,
                        45.446104,
                        45.3926,
                        45.341395,
                        45.292512,
                        45.245982,
                        45.201845,
                        45.160152,
                        45.120956,
                        45.08431,
                        45.050261,
                        45.018854,
                        44.902732,
                        44.879894,
                        45.1028,
                        45.484067,
                        45.94293
                      ],
                      [
                        49.864464,
                        48.83669,
                        47.946807,
                        47.061383,
                        45.978176,
                        45.412262,
                        45.3038,
                        45.197653,
                        45.094062,
                        44.993237,
                        44.89535,
                        44.800543,
                        44.708929,
                        44.62059,
                        44.535583,
                        44.453939,
                        44.095729,
                        43.910397,
                        44.202606,
                        44.569077,
                        44.962338
                      ],
                      [
                        48.678294,
                        47.59339,
                        46.656439,
                        45.829334,
                        45.087183,
                        44.742384,
                        44.675298,
                        44.608808,
                        44.542903,
                        44.47757,
                        44.4128,
                        44.348581,
                        44.284902,